{
  "campaign_id": "rotated-surface-baseline",
  "candidate_id": "rotated-surface-d7-example",
  "code_family": "rotated-surface-code",
  "parameters": {
    "distance": 7,
    "layout": "rotated"
  },
  "provenance": {
    "kind": "seed",
    "label": "repo-example-d7",
    "strategy": "grid"
  },
  "run_id": "m1-demo",
  "status": "evaluated"
}
