{
  "campaign_id": "rotated-surface-baseline",
  "candidate_id": "rotated-surface-d3-example",
  "code_family": "rotated-surface-code",
  "parameters": {
    "distance": 3,
    "layout": "rotated"
  },
  "provenance": {
    "kind": "seed",
    "label": "repo-example"
  },
  "run_id": "2026-06-09-example",
  "status": "placeholder"
}
