{
  "campaign_id": "decoder-registry-css-bb-smoke",
  "candidate_id": "bivariate-bicycle-code-m6-n6",
  "code_family": "bivariate-bicycle-code",
  "parameters": {
    "hd": [
      [
        1,
        1
      ],
      [
        0,
        2
      ]
    ],
    "m": 6,
    "n": 6,
    "vc": [
      [
        1,
        0
      ],
      [
        0,
        1
      ]
    ]
  },
  "provenance": {
    "kind": "zoo-instance",
    "label": "fixed BB CSS decoder-registry validation instance"
  },
  "run_id": "issue16-bb-css-validation",
  "status": "evaluated"
}
